{
  "version": 1,
  "topic": {
    "kind": "place",
    "query": "Portland Floral",
    "timezone": "America/Los_Angeles",
    "locale": "en-US",
    "userLocationHint": "Portland, OR"
  },
  "hero": {
    "title": "Portland Floral",
    "confidence": "high",
    "lastCheckedIso": "2026-02-14T12:00:00.0000000+00:00",
    "statusLine": "Open now",
    "closesText": "Today: 9:00 AM - 6:00 PM",
    "address": "145 SW Morrison St, Portland, OR 97204",
    "phone": "(503) 555-1234",
    "website": "https://example-florist.test",
    "directionsUrl": "https://maps.google.com/?q=Portland+Floral"
  },
  "cards": [
    {
      "type": "hours",
      "title": "Hours",
      "bullets": [
        "Monday: 9:00 AM - 6:00 PM",
        "Tuesday: 9:00 AM - 6:00 PM",
        "Wednesday: 9:00 AM - 6:00 PM",
        "Thursday: 9:00 AM - 6:00 PM",
        "Friday: 9:00 AM - 6:00 PM",
        "Saturday: 10:00 AM - 4:00 PM",
        "Sunday: Closed"
      ],
      "sources": [
        {
          "name": "Google Places",
          "url": "https://maps.google.com/?q=Portland+Floral",
          "fetchedIso": "2026-02-14T12:00:00.0000000+00:00"
        }
      ]
    },
    {
      "type": "reviews",
      "title": "Reviews",
      "bullets": [
        "Average rating: 4.7 across 312 ratings.",
        "People praise same-day arrangements and friendly staff.",
        "Most complaints mention holiday rush delays."
      ],
      "sources": [
        {
          "name": "Google Places",
          "url": "https://maps.google.com/?q=Portland+Floral",
          "fetchedIso": "2026-02-14T12:00:00.0000000+00:00"
        }
      ]
    },
    {
      "type": "summary",
      "title": "What to Expect",
      "bullets": [
        "Strong reputation for custom arrangements and delivery reliability.",
        "Best for same-day bouquets and event centerpieces.",
        "Call ahead during holidays to confirm delivery windows."
      ],
      "sources": [
        {
          "name": "Google Places",
          "url": "https://maps.google.com/?q=Portland+Floral",
          "fetchedIso": "2026-02-14T12:00:00.0000000+00:00"
        }
      ]
    },
    {
      "type": "links",
      "title": "Useful Links",
      "bullets": [
        "Website: https://example-florist.test",
        "Directions: https://maps.google.com/?q=Portland+Floral"
      ],
      "sources": [
        {
          "name": "Google Places",
          "url": "https://maps.google.com/?q=Portland+Floral",
          "fetchedIso": "2026-02-14T12:00:00.0000000+00:00"
        }
      ]
    }
  ],
  "map": {
    "latitude": 45.5231,
    "longitude": -122.6765,
    "label": "Portland Floral"
  },
  "audit": [
    {
      "step": "search",
      "detail": "Queried place by text.",
      "timestampIso": "2026-02-14T11:59:57.0000000+00:00",
      "sources": [
        {
          "name": "Google Places",
          "url": "https://maps.google.com/?q=Portland+Floral",
          "fetchedIso": "2026-02-14T11:59:57.0000000+00:00"
        }
      ]
    },
    {
      "step": "details_fetch",
      "detail": "Fetched place details and structured hours.",
      "timestampIso": "2026-02-14T11:59:58.0000000+00:00",
      "sources": [
        {
          "name": "Google Places",
          "url": "https://maps.google.com/?q=Portland+Floral",
          "fetchedIso": "2026-02-14T11:59:58.0000000+00:00"
        }
      ]
    },
    {
      "step": "assemble",
      "detail": "Built ordered cards and hero.",
      "timestampIso": "2026-02-14T12:00:00.0000000+00:00",
      "sources": [
        {
          "name": "Google Places",
          "url": "https://maps.google.com/?q=Portland+Floral",
          "fetchedIso": "2026-02-14T12:00:00.0000000+00:00"
        }
      ]
    }
  ]
}
