{
  "version": 1,
  "topic": {
    "kind": "product",
    "query": "Logitech MX Master 3S",
    "timezone": "America/Denver",
    "locale": "en-US"
  },
  "hero": {
    "title": "Logitech MX Master 3S",
    "confidence": "medium",
    "lastCheckedIso": "2026-02-14T12:00:00.0000000+00:00",
    "statusLine": "Price and availability vary by retailer",
    "closesText": ""
  },
  "cards": [
    {
      "type": "listings",
      "title": "Top Listings",
      "bullets": [
        "Major electronics retailers list this model in stock.",
        "Bundles with wrist rests appear intermittently.",
        "Refurbished listings are common in secondary marketplaces."
      ],
      "sources": [
        {
          "name": "Retail Search",
          "url": "https://example-retailer.test/mx-master-3s",
          "fetchedIso": "2026-02-14T12:00:00.0000000+00:00"
        }
      ]
    },
    {
      "type": "price_bands",
      "title": "Price Bands",
      "bullets": [
        "New: typically $95 - $120 depending on color and store.",
        "Open-box: commonly $75 - $95.",
        "Refurbished: often $60 - $85 with shorter warranty terms."
      ],
      "sources": [
        {
          "name": "Retail Search",
          "url": "https://example-retailer.test/mx-master-3s",
          "fetchedIso": "2026-02-14T12:00:00.0000000+00:00"
        }
      ]
    },
    {
      "type": "reviews",
      "title": "Review Sentiment",
      "bullets": [
        "People praise battery life and cross-device workflow.",
        "Common complaints mention weight and side-button placement.",
        "Best for office productivity over competitive gaming."
      ],
      "sources": [
        {
          "name": "Review Aggregates",
          "url": "https://example-reviews.test/mx-master-3s",
          "fetchedIso": "2026-02-14T12:00:00.0000000+00:00"
        }
      ]
    },
    {
      "type": "gotchas",
      "title": "Gotchas",
      "bullets": [
        "Advanced customization requires companion software.",
        "USB receiver can be easy to misplace if traveling frequently.",
        "Left-handed ergonomics are limited."
      ],
      "sources": [
        {
          "name": "Review Aggregates",
          "url": "https://example-reviews.test/mx-master-3s",
          "fetchedIso": "2026-02-14T12:00:00.0000000+00:00"
        }
      ]
    }
  ],
  "audit": [
    {
      "step": "search",
      "detail": "Collected retailer and review sources.",
      "timestampIso": "2026-02-14T11:59:55.0000000+00:00",
      "sources": [
        {
          "name": "Retail Search",
          "url": "https://example-retailer.test/mx-master-3s",
          "fetchedIso": "2026-02-14T11:59:55.0000000+00:00"
        }
      ]
    },
    {
      "step": "assemble",
      "detail": "Ranked cards and generated briefing payload.",
      "timestampIso": "2026-02-14T12:00:00.0000000+00:00",
      "sources": [
        {
          "name": "Review Aggregates",
          "url": "https://example-reviews.test/mx-master-3s",
          "fetchedIso": "2026-02-14T12:00:00.0000000+00:00"
        }
      ]
    }
  ]
}
